{
  "verdict": "pass",
  "checks": [
    {
      "kind": "deterministic",
      "name": "typecheck",
      "result": "pass",
      "evidence": "시스템 기록: 타입 파일 11개 생성, tsc 오류 없음, exit 0. Reviewer 가 같은 commit(example-project, task/T-9001-example, 0123456789abcdef0123456789abcdef01234567)에서 다시 돌려 같은 결과를 얻었다."
    },
    {
      "kind": "semantic",
      "name": "문서의 서술이 코드와 어긋나지 않는가",
      "result": "pass",
      "evidence": "문서의 3절을 코드와 대조했다: \"lock 은 항상 해제된다\" 는 서술은 finally 절로 확인된다.\n다만 key: value 모양의 예시 # 1 은 실행해 보지 않았다."
    },
    {
      "kind": "semantic",
      "name": "범위를 벗어난 변경이 없는가",
      "result": "skipped"
    }
  ],
  "done_when": [
    {
      "condition": "예시 문서가 있다",
      "met": true,
      "evidence": "artifact://T-9001/step-001/example-doc@v1 을 읽었다."
    },
    {
      "condition": "예시 문서에 \"확인하지 못한 것\" 절이 있다",
      "met": true
    }
  ],
  "comments": [
    {
      "severity": "risk",
      "class": "B",
      "text": "문서 2절의 \"재시도는 3회\" 는 코드의 상수(RETRY: 5)와 다르다 — 어느 쪽이 맞는지 확인하지 못했다.\n뒤의 Step 에서 다뤄야 한다: #12 항목 참조."
    },
    {
      "severity": "note",
      "class": "C",
      "text": "- 목록처럼 시작하는 문장, '작은따옴표', 그리고 끝의 콜론도 그대로 옮겨져야 한다:"
    }
  ],
  "packet_gaps": [
    "verify 의 \"validate-data\" 검사의 실제 명령이 패킷에 없었다: Step 정의의 서술만 보고 명령을 추정해 실행했다.",
    "기준 SHA 가 패킷에 없어 # 표시된 Ledger 의 값을 썼다."
  ]
}
